{
  "$schema": "https://schemas.unifold.org/ui-module/1.0/schema.json",
  "schemaVersion": "1.0.0",
  "id": "org.unifold.reference.shared",
  "version": "1.0.0",
  "imports": [],
  "exports": {
    "documents": [],
    "compositions": [],
    "resources": [
      {
        "kind": "message",
        "id": "profile-heading",
        "value": "Module-authored profile"
      }
    ]
  }
}
